Letter,Text
11,"1. Your friend and I have had a conversation. He is a man of ability; his very first words showed what spirit and understanding he possesses, and what progress he has already made. He gave me a foretaste, and he will not fail to answer thereto. For he spoke not from forethought, but was suddenly caught off his guard. When he tried to collect himself, he could scarcely banish that hue of modesty, which is a good sign in a young man; the blush that spread over his face seemed so to rise from the depths. And I feel sure that his habit of blushing will stay with him after he has strengthened his character, stripped off all his faults, and become wise. For by no wisdom can natural weaknesses of the body be removed. That which is implanted and inborn can be toned down by training, but not overcome. 2. The steadiest speaker, when before the public, often breaks into a perspiration, as if he had wearied or over-heated himself; some tremble in the knees when they rise to speak; I know of some whose teeth chatter, whose tongues falter, whose lips quiver. Training and experience can never shake off this habit; nature exerts her own power and through such a weakness makes her presence known even to the strongest. 3. I know that the blush, too, is a habit of this sort, spreading suddenly over the faces of the most dignified men. It is, indeed more prevalent in youth, because of the warmer blood and the sensitive countenance; nevertheless, both seasoned men and aged men are affected by it. Some are most dangerous when they redden, as if they were letting all their sense of shame escape. 4. Sulla, when the blood mantled his cheeks, was in his fiercest mood. Pompey had the most sensitive cast of countenance; he always blushed in the presence of a gathering, and especially at a public assembly. Fabianus also, I remember, reddened when he appeared as a witness before the senate; and his embarrassment became him to a remarkable degree. 5. Such a habit is not due to mental weakness, but to the novelty of a situation; an inexperienced person is not necessarily confused, but is usually affected, because he slips into this habit by natural tendency of the body. Just as certain men are full-blooded, so others are of a quick and mobile blood, that rushes to the face at once.

6. As I remarked, Wisdom can never remove this habit; for if she could rub out all our faults, she would be mistress of the universe. Whatever is assigned to us by the terms of our birth and the blend in our constitutions, will stick with us, no matter how hard or how long the soul may have tried to master itself. And we cannot forbid these feelings any more than we can summon them. 7. Actors in the theatre, who imitate the emotions, who portray fear and nervousness, who depict sorrow, imitate bashfulness by hanging their heads, lowering their voices, and keeping their eyes fixed and rooted upon the ground. They cannot, however, muster a blush; for the blush cannot be prevented or acquired. Wisdom will not assure us of a remedy, or give us help against it; it comes or goes unbidden, and is a law unto itself.

8. But my letter calls for its closing sentence. Hear and take to heart this useful and wholesome motto:[1] ""Cherish some man of high character, and keep him ever before your eyes, living as if he were watching you, and ordering all your actions as if he beheld them."" 9. Such, my dear Lucilius, is the counsel of Epicurus;[2] he has quite properly given us a guardian and an attendant. We can get rid of most sins, if we have a witness who stands near us when we are likely to go wrong. The soul should have someone whom it can respect, ? one by whose authority it may make even its inner shrine more hallowed.[3] Happy is the man who can make others better, not merely when he is in their company, but even when he is in their thoughts! And happy also is he who can so revere a man as to calm and regulate himself by calling him to mind! One who can so revere another, will soon be himself worthy of reverence. 10. Choose therefore a Cato; or, if Cato seems too severe a model, choose some Laelius, a gentler spirit. Choose a master whose life, conversation, and soul-expressing face have satisfied you; picture him always to yourself as your protector or your pattern. For we must indeed have someone according to whom we may regulate our characters; you can never straighten that which is crooked unless you use a ruler. Farewell."
12,"1. Wherever I turn, I see evidences of my advancing years. I visited lately my country-place, and protested against the money which was spent on the tumble-down building. My bailiff maintained that the flaws were not due to his own carelessness; ""he was doing everything possible, but the house was old."" And this was the house which grew under my own hands! What has the future in store for me, if stones of my own age are already crumbling? 2. I was angry, and I embraced the first opportunity to vent my spleen in the bailiff's presence. ""It is clear,"" I cried, ""that these plane-trees are neglected; they have no leaves. Their branches are so gnarled and shrivelled; the boles are so rough and unkempt! This would not happen, if someone loosened the earth at their feet, and watered them."" The bailiff swore by my protecting deity that ""he was doing everything possible, and never relaxed his efforts, but those trees were old."" Between you and me, I had planted those trees myself, I had seen them in their first leaf. 3. Then I turned to the door and asked: ""Who is that broken-down dotard? You have done well to place him at the entrance; for he is outward bound.[1] Where did you get him? What pleasure did it give you to take up for burial some other man's dead?""[2] But the slave said: ""Don't you know me, sir? I am Felicio; you used to bring me little images.[3] My father was Philositus the steward, and I am your pet slave."" ""The man is clean crazy,"" I remarked. ""Has my pet slave become a little boy again? But it is quite possible; his teeth are just dropping out.""[4]

4. I owe it to my country-place that my old age became apparent whithersoever I turned. Let us cherish and love old age; for it is full of pleasure if one knows how to use it. Fruits are most welcome when almost over; youth is most charming at its close; the last drink delights the toper, the glass which souses him and puts the finishing touch on his drunkenness. 5. Each pleasure reserves to the end the greatest delights which it contains. Life is most delightful when it is on the downward slope, but has not yet reached the abrupt decline. And I myself believe that the period which stands, so to speak, on the edge of the roof, possesses pleasures of its own. Or else the very fact of our not wanting pleasures has taken the place of the pleasures themselves. How comforting it is to have tired out one's appetites, and to have done with them! 6. ""But,"" you say, ""it is a nuisance to be looking death in the face!"" Death, however, should be looked in the face by young and old alike. We are not summoned according to our rating on the censor's list.[5] Moreover, no one is so old that it would be improper for him to hope for another day of existence. And one day, mind you, is a stage on life's journey.

Our span of life is divided into parts; it consists of large circles enclosing smaller. One circle embraces and bounds the rest; it reaches from birth to the last day of existence. The next circle limits the period of our young manhood. The third confines all of childhood in its circumference. Again, there is, in a class by itself, the year; it contains within itself all the divisions of time by the multiplication of which we get the total of life. The month is bounded by a narrower ring. The smallest circle of all is the day; but even a day has its beginning and its ending, its sunrise and its sunset. 7. Hence Heraclitus, whose obscure style gave him his surname,[6] remarked: ""One day is equal to every day."" Different persons have interpreted the saying in different ways. Some hold that days are equal in number of hours, and this is true; for if by ""day"" we mean twenty-four hours' time, all days must be equal, inasmuch as the night acquires what the day loses. But others maintain that one day is equal to all days through resemblance, because the very longest space of time possesses no element which cannot be found in a single day, ? namely, light and darkness, ? and even to eternity day makes these alternations[7] more numerous, not different when it is shorter and different again when it is longer. 8. Hence, every day ought to be regulated as if it closed the series, as if it rounded out and completed our existence.

Pacuvius, who by long occupancy made Syria his own,[8] used to hold a regular burial sacrifice in his own honour, with wine and the usual funeral feasting, and then would have himself carried from the dining-room to his chamber, while eunuchs applauded and sang in Greek to a musical accompaniment: ""He has lived his life, he has lived his life!"" 9. Thus Pacuvius had himself carried out to burial every day. Let us, however, do from a good motive what he used to do from a debased motive; let us go to our sleep with joy and gladness; let us say:

I have lived; the course which Fortune set for me
Is finished.[9]

And if God is pleased to add another day, we should welcome it with glad hearts. That man is happiest, and is secure in his own possession of himself, who can await the morrow without apprehension. When a man has said: ""I have lived!"", every morning he arises he receives a bonus.

10. But now I ought to close my letter. ""What?"" you say; ""shall it come to me without any little offering?"" Be not afraid; it brings something, ? nay, more than something, a great deal. For what is more noble than the following saying[10] of which I make this letter the bearer: ""It is wrong to live under constraint; but no man is constrained to live under constraint."" Of course not. On all sides lie many short and simple paths to freedom; and let us thank God that no man can be kept in life. We may spurn the very constraints that hold us. 11. ""Epicurus,"" you reply, ""uttered these words; what are you doing with another's property?"" Any truth, I maintain, is my own property. And I shall continue to heap quotations from Epicurus upon you, so that all persons who swear by the words of another, and put a value upon the speaker and not upon the thing spoken, may understand that the best ideas are common property. Farewell."
13,"1. I know that you have plenty of spirit; for even before you began to equip yourself with maxims which were wholesome and potent to overcome obstacles, you were taking pride in your contest with Fortune; and this is all the more true, now that you have grappled with Fortune and tested your powers. For our powers can never inspire in us implicit faith in ourselves except when many difficulties have confronted us on this side and on that, and have occasionally even come to close quarters with us. It is only in this way that the true spirit can be tested, ? the spirit that will never consent to come under the jurisdiction of things external to ourselves. 2. This is the touchstone of such a spirit; no prizefighter can go with high spirits into the strife if he has never been beaten black and blue; the only contestant who can confidently enter the lists is the man who has seen his own blood, who has felt his teeth rattle beneath his opponent's fist, who has been tripped and felt the full force of his adversary's charge, who has been downed in body but not in spirit, one who, as often as he falls, rises again with greater defiance than ever. 3. So then, to keep up my figure, Fortune has often in the past got the upper hand of you, and yet you have not surrendered, but have leaped up and stood your ground still more eagerly. For manliness gains much strength by being challenged; nevertheless, if you approve, allow me to offer some additional safeguards by which you may fortify yourself.

4. There are more things, Lucilius, likely to frighten us than there are to crush us; we suffer more often in imagination than in reality. I am not speaking with you in the Stoic strain but in my milder style. For it is our Stoic fashion to speak of all those things, which provoke cries and groans, as unimportant and beneath notice; but you and I must drop such great-sounding words, although, heaven knows, they are true enough. What I advise you to do is, not to be unhappy before the crisis comes; since it may be that the dangers before which you paled as if they were threatening you, will never come upon you; they certainly have not yet come. 5. Accordingly, some things torment us more than they ought; some torment us before they ought; and some torment us when they ought not to torment us at all. We are in the habit of exaggerating, or imagining, or anticipating, sorrow.

The first of these three faults[1] may be postponed for the present, because the subject is under discussion and the case is still in court, so to speak. That which I should call trifling, you will maintain to be most serious; for of course I know that some men laugh while being flogged, and that others wince at a box on the ear. We shall consider later whether these evils derive their power from their own strength, or from our own weakness.

6. Do me the favour, when men surround you and try to talk you into believing that you are unhappy, to consider not what you hear but what you yourself feel, and to take counsel with your feelings and question yourself independently, because you know your own affairs better than anyone else does. Ask: ""Is there any reason why these persons should condole with me? Why should they be worried or even fear some infection from me, as if troubles could be transmitted? Is there any evil involved, or is it a matter merely of ill report, rather than an evil?"" Put the question voluntarily to yourself: ""Am I tormented without sufficient reason, am I morose, and do I convert what is not an evil into what is an evil?"" 7. You may retort with the question: ""How am I to know whether my sufferings are real or imaginary?"" Here is the rule for such matters: we are tormented either by things present, or by things to come, or by both. As to things present, the decision is easy. Suppose that your person enjoys freedom and health, and that you do not suffer from any external injury. As to what may happen to it in the future, we shall see later on. To-day there is nothing wrong with it. 8. ""But,"" you say, ""something will happen to it."" First of all, consider whether your proofs of future trouble are sure. For it is more often the case that we are troubled by our apprehensions, and that we are mocked by that mocker, rumour, which is wont to settle wars, but much more often settles individuals. Yes, my dear Lucilius; we agree too quickly with what people say. We do not put to the test those things which cause our fear; we do not examine into them; we blench and retreat just like soldiers who are forced to abandon their camp because of a dust-cloud raised by stampeding cattle, or are thrown into a panic by the spreading of some unauthenticated rumour. 9. And somehow or other it is the idle report that disturbs us most. For truth has its own definite boundaries, but that which arises from uncertainty is delivered over to guesswork and the irresponsible license of a frightened mind. That is why no fear is so ruinous and so uncontrollable as panic fear. For other fears are groundless, but this fear is witless.

10. Let us, then, look carefully into the matter. It is likely that some troubles will befall us; but it is not a present fact. How often has the unexpected happened! How often has the expected never come to pass! And even though it is ordained to be, what does it avail to run out to meet your suffering? You will suffer soon enough, when it arrives; so look forward meanwhile to better things. 11. What shall you gain by doing this? Time. There will be many happenings meanwhile which will serve to postpone, or end, or pass on to another person, the trials which are near or even in your very presence. A fire has opened the way to flight. Men have been let down softly by a catastrophe. Sometimes the sword has been checked even at the victim's throat. Men have survived their own executioners. Even bad fortune is fickle. Perhaps it will come, perhaps not; in the meantime it is not. So look forward to better things.

12. The mind at times fashions for itself false shapes of evil when there are no signs that point to any evil; it twists into the worst construction some word of doubtful meaning; or it fancies some personal grudge to be more serious than it really is, considering not how angry the enemy is, but to what lengths he may go if he is angry. But life is not worth living, and there is no limit to our sorrows, if we indulge our fears to the greatest possible extent; in this matter, let prudence help you, and contemn with a resolute spirit even when it is in plain sight. If you cannot do this, counter one weakness with another, and temper your fear with hope. There is nothing so certain among these objects of fear that it is not more certain still that things we dread sink into nothing and that things we hope for mock us.

13. Accordingly, weigh carefully your hopes as well as your fears, and whenever all the elements are in doubt, decide in your own favour; believe what you prefer. And if fear wins a majority of the votes, incline in the other direction anyhow, and cease to harass your soul, reflecting continually that most mortals, even when no troubles are actually at hand or are certainly to be expected in the future, become excited and disquieted. No one calls a halt on himself, when he begins to be urged ahead; nor does he regulate his alarm according to the truth. No one says; ""The author of the story is a fool, and he who has believed it is a fool, as well as he who fabricated it."" We let ourselves drift with every breeze; we are frightened at uncertainties, just as if they were certain. We observe no moderation. The slightest thing turns the scales and throws us forthwith into a panic.

14. But I am ashamed either to admonish you sternly or to try to beguile you with such mild remedies.[2] Let another say. ""Perhaps the worst will not happen."" You yourself must say. ""Well, what if it does happen? Let us see who wins! Perhaps it happens for my best interests; it may be that such a death will shed credit upon my life."" Socrates was ennobled by the hemlock draught. Wrench from Cato's hand his sword, the vindicator of liberty, and you deprive him of the greatest share of his glory. 15. I am exhorting you far too long, since you need reminding rather than exhortation. The path on which I am leading you is not different from that on which your nature leads you; you were born to such conduct as I describe. Hence there is all the more reason why you should increase and beautify the good that is in you.

16. But now, to close my letter, I have only to stamp the usual seal upon it, in other words, to commit thereto some noble message to be delivered to you: ""The fool, with all his other faults, has this also, he is always getting ready to live.""[3] Reflect, my esteemed Lucilius, what this saying means, and you will see how revolting is the fickleness of men who lay down every day new foundations of life, and begin to build up fresh hopes even at the brink of the grave. 17. Look within your own mind for individual instances; you will think of old men who are preparing themselves at that very hour for a political career, or for travel, or for business. And what is baser than getting ready to live when you are already old? I should not name the author of this motto, except that it is somewhat unknown to fame and is not one of those popular sayings of Epicurus which I have allowed myself to praise and to appropriate. Farewell."
